{
  "$schema": "https://json-schema.org/draft/2020-12/schema",
  "$id": "https://schemas.npi.local/n2b1p_b_source_evidence_v1.schema.json",
  "title": "N2B1P Route B source evidence v1",
  "type": "object", "additionalProperties": false,
  "required": ["schema_version", "status", "source_root_ref", "source_access", "source_root_identity", "python_qualification_commit", "python_qualification_checkpoint_sha256", "artifacts", "network_access", "mandatory_stop"],
  "properties": {
    "schema_version": {"const": "1.0"}, "status": {"const": "OWNER_SOURCE_IDENTIFICATION_REQUIRED"},
    "source_root_ref": {"const": "OWNER_TO_IDENTIFY_EXTERNAL_QUARANTINE_ROOT"}, "source_access": {"const": "NOT_RUN"},
    "source_root_identity": {"const": "0000000000000000000000000000000000000000000000000000000000000000"},
    "python_qualification_commit": {"const": "639a503fa3c04c5fcc8640d8bee372377f3953d1"},
    "python_qualification_checkpoint_sha256": {"const": "4974afbb1a022fdba0ffe6647a9fcb549d18234b69c864b35c7a2896e84ab128"},
    "artifacts": {"type": "array", "minItems": 3, "maxItems": 3, "uniqueItems": true, "items": {"oneOf": [
      {"const": {"id": "torchvision-keypointrcnn-resnet50-fpn-coco-v1", "revision": "torchvision-v0.22.1", "filename": "keypointrcnn_resnet50_fpn_coco-fc266e95.pth", "byte_count": 237034793, "local_sha256": "fc266e953d2b302cdcbb9ae66f71f6b0d4649928bf02dc573961e361e4918926", "transfer_manifest_sha256": "90da3eb000813841a980dcbaf8e1b31fdde15283a9d6b969156c5eb0ae21ce43"}},
      {"const": {"id": "torchvision-lraspp-mobilenet-v3-large-coco-voc-v1", "revision": "torchvision-v0.22.1", "filename": "lraspp_mobilenet_v3_large-d234d4ea.pth", "byte_count": 13097061, "local_sha256": "d234d4eae9d55d5f76de18b77cf0dc62c66fe5c5482758209d00f950c92bb280", "transfer_manifest_sha256": "d25cc430637cf19ebab31cd5aa99e344b4da58cd2b04db245c165181e3ff1f12"}},
      {"const": {"id": "torchvision-deeplabv3-mobilenet-v3-large-coco-voc-v1", "revision": "torchvision-v0.22.1", "filename": "deeplabv3_mobilenet_v3_large-fc3c493d.pth", "byte_count": 44356159, "local_sha256": "fc3c493d68e89cc31ef488c803d5d7dd2f3190fb570598faa49fef69be8e5e70", "transfer_manifest_sha256": "676054e8b2c366f591a1bbe1b4521e2ef7abdb08197534ca95eb11d434dd0cae"}}
    ]}},
    "network_access": {"const": "DENY"},
    "mandatory_stop": {"type": "object", "additionalProperties": false, "required": ["value", "next_action"], "properties": {"value": {"const": true}, "next_action": {"const": "OWNER_IDENTIFY_SOURCE_BEFORE_REPROVISION"}}}
  }
}
