{
  "schema_version": "1.0",
  "status": "OWNER_SOURCE_IDENTIFICATION_REQUIRED",
  "source_root_ref": "OWNER_TO_IDENTIFY_EXTERNAL_QUARANTINE_ROOT",
  "source_access": "NOT_RUN",
  "source_root_identity": "0000000000000000000000000000000000000000000000000000000000000000",
  "python_qualification_commit": "639a503fa3c04c5fcc8640d8bee372377f3953d1",
  "python_qualification_checkpoint_sha256": "4974afbb1a022fdba0ffe6647a9fcb549d18234b69c864b35c7a2896e84ab128",
  "artifacts": [
    {"id": "torchvision-keypointrcnn-resnet50-fpn-coco-v1", "revision": "torchvision-v0.22.1", "filename": "keypointrcnn_resnet50_fpn_coco-fc266e95.pth", "byte_count": 237034793, "local_sha256": "fc266e953d2b302cdcbb9ae66f71f6b0d4649928bf02dc573961e361e4918926", "transfer_manifest_sha256": "90da3eb000813841a980dcbaf8e1b31fdde15283a9d6b969156c5eb0ae21ce43"},
    {"id": "torchvision-lraspp-mobilenet-v3-large-coco-voc-v1", "revision": "torchvision-v0.22.1", "filename": "lraspp_mobilenet_v3_large-d234d4ea.pth", "byte_count": 13097061, "local_sha256": "d234d4eae9d55d5f76de18b77cf0dc62c66fe5c5482758209d00f950c92bb280", "transfer_manifest_sha256": "d25cc430637cf19ebab31cd5aa99e344b4da58cd2b04db245c165181e3ff1f12"},
    {"id": "torchvision-deeplabv3-mobilenet-v3-large-coco-voc-v1", "revision": "torchvision-v0.22.1", "filename": "deeplabv3_mobilenet_v3_large-fc3c493d.pth", "byte_count": 44356159, "local_sha256": "fc3c493d68e89cc31ef488c803d5d7dd2f3190fb570598faa49fef69be8e5e70", "transfer_manifest_sha256": "676054e8b2c366f591a1bbe1b4521e2ef7abdb08197534ca95eb11d434dd0cae"}
  ],
  "network_access": "DENY",
  "mandatory_stop": {"value": true, "next_action": "OWNER_IDENTIFY_SOURCE_BEFORE_REPROVISION"}
}
